<?xml version="1.0" encoding="UTF-8"?>

<!--
    Document   : ApiDoc.xml
    Created on : 2010年9月20日, 下午1:41
    Author     : x-spirit
    Description:
        Purpose of the document follows.
-->

<weiboAPIs xmlns:xsi="http://www.w3.org/2001/XMLSchema-instance" xsi:noNamespaceSchemaLocation="ApiDoc.xsd">
    <version value="1.0">
        <class id="ss" index="1" desc="ss">
            <catagory id="aa" index="1" desc="aa">
                <api id="public_timeline" index="1" desc="sls">
                    <url>statuses/public_timeline</url>
                    <formats>
                        <format>XML</format>
                        <format>JSON</format>
                    </formats>
                    <methods>
                        <method>GET</method>
                        <method>POST</method>
                    </methods>
                    <enctype>application/x-www-form-urlencoded</enctype>
                    <auth>true</auth>
                    <rate_limit>true</rate_limit>
                    <params>
                        <param id="count" isRest="false" required="false" desc="dlss"></param>
                    </params>
                    <description>sser</description>
                </api>
            </catagory>
        </class>
        
    </version>

</weiboAPIs>
